{
  "$schema": "./schema.json",
  "schemaVersion": "1.0",
  "releaseLine": "0.1.x-alpha",
  "releaseVersion": "0.1.0-alpha.1",
  "packageName": "better-realtime",
  "webSocketSubprotocol": "better-realtime.v1",
  "features": [
    { "id": "react-web", "title": "React Web client", "protocolStatus": "not-applicable", "runtimeStatus": "implemented", "roadmapStatus": "current-alpha", "verifiedEnvironments": ["React 19", "Chromium desktop and narrow viewport"], "protocolEvidence": [], "runtimeEvidence": ["packages/runtime/src/index.ts", "packages/runtime/src/react.ts"], "verificationEvidence": ["packages/runtime/test/react-lifecycle.test.tsx", "scripts/verify-consumer-journey.ts"] },
    { "id": "node-postgres-server", "title": "Node.js/PostgreSQL reference profile", "protocolStatus": "not-applicable", "runtimeStatus": "implemented", "roadmapStatus": "current-alpha", "verifiedEnvironments": ["Node.js 22.19.0 ESM", "PostgreSQL 18.4"], "protocolEvidence": [], "runtimeEvidence": ["packages/runtime/src/server.ts", "packages/store-postgres/src/index.ts"], "verificationEvidence": ["packages/store-postgres/test/postgres.integration.test.ts", "packages/runtime/test/server-surface.test.ts"] },
    { "id": "cursor-command-recovery", "title": "Cursor replay and command status recovery", "protocolStatus": "defined", "runtimeStatus": "implemented", "roadmapStatus": "current-alpha", "verifiedEnvironments": ["native browser WebSocket", "Node ws", "two independent gateways"], "protocolEvidence": ["spec/protocol/v1/wire.schema.json", "conformance/v1/scenarios.json"], "runtimeEvidence": ["packages/core/src/client.ts", "packages/server-node/src/postgres-gateway.ts"], "verificationEvidence": ["packages/core/test/recovery.integration.test.ts", "packages/store-postgres/test/postgres.integration.test.ts", "scripts/verify-consumer-journey.ts"] },
    { "id": "offline-diagnostics", "title": "Offline CLI and stdio MCP diagnostics", "protocolStatus": "not-applicable", "runtimeStatus": "implemented", "roadmapStatus": "current-alpha", "verifiedEnvironments": ["local explicitly extracted evidence bundle"], "protocolEvidence": [], "runtimeEvidence": ["packages/runtime/src/diagnostic-io.ts", "packages/runtime/src/mcp.ts"], "verificationEvidence": ["packages/runtime/test/diagnostic-tools.test.ts", "scripts/verify-consumer-journey.ts"] },
    { "id": "websocket-origin-policy", "title": "Fail-closed browser WebSocket Origin policy", "protocolStatus": "not-applicable", "runtimeStatus": "implemented", "roadmapStatus": "current-alpha", "verifiedEnvironments": ["Node ws upgrade", "Chromium cross-origin handshake", "TLS reverse proxy WSS"], "protocolEvidence": [], "runtimeEvidence": ["packages/server-node/src/origin-policy.ts", "packages/server-node/src/postgres-gateway.ts"], "verificationEvidence": ["packages/server-node/test/origin-policy.test.ts", "packages/store-postgres/test/postgres.integration.test.ts", "tests/e2e/recovery.spec.ts"] },
    { "id": "postgres-storage-namespace", "title": "Bound PostgreSQL storage namespace and deploy migration", "protocolStatus": "not-applicable", "runtimeStatus": "implemented", "roadmapStatus": "current-alpha", "verifiedEnvironments": ["PostgreSQL 18.4", "separate migration and runtime roles"], "protocolEvidence": [], "runtimeEvidence": ["packages/store-postgres/src/index.ts", "packages/store-postgres/src/migrations.ts"], "verificationEvidence": ["packages/store-postgres/test/postgres.integration.test.ts", "packages/store-postgres/test/transaction.test.ts"] },
    { "id": "exact-contract-compatibility", "title": "Exact contract manifest compatibility", "protocolStatus": "defined", "runtimeStatus": "implemented", "roadmapStatus": "current-alpha", "verifiedEnvironments": ["TypeScript client and Node gateway"], "protocolEvidence": ["spec/protocol/v1/wire.schema.json"], "runtimeEvidence": ["packages/runtime/src/contract.ts", "packages/server-node/src/postgres-gateway.ts"], "verificationEvidence": ["packages/runtime/test/contract.test.ts", "packages/server-node/test/application-query.test.ts"] },
    { "id": "declared-capture-completeness", "title": "Diagnostics complete for declared capture topology", "protocolStatus": "not-applicable", "runtimeStatus": "implemented", "roadmapStatus": "current-alpha", "verifiedEnvironments": ["gateway server and colocated PostgreSQL store recorder bundle"], "protocolEvidence": [], "runtimeEvidence": ["packages/runtime/src/server.ts", "packages/runtime/src/diagnostic-io.ts"], "verificationEvidence": ["packages/store-postgres/test/postgres.integration.test.ts", "packages/diagnostics/test/query.test.ts"] },
    { "id": "session-resume-restoration", "title": "Resume-token session restoration", "protocolStatus": "defined", "runtimeStatus": "unsupported", "roadmapStatus": "not-planned", "verifiedEnvironments": [], "protocolEvidence": ["spec/protocol/v1/wire.schema.json", "conformance/v1/scenarios.json"], "runtimeEvidence": ["packages/core/src/client.ts", "packages/server-node/src/postgres-gateway.ts"], "verificationEvidence": ["packages/core/test/lifecycle.test.ts", "packages/server-node/test/validation.test.ts"] },
    { "id": "auth-refresh", "title": "In-session authentication refresh", "protocolStatus": "defined", "runtimeStatus": "unsupported", "roadmapStatus": "not-planned", "verifiedEnvironments": [], "protocolEvidence": ["spec/protocol/v1/wire.schema.json", "conformance/v1/scenarios.json"], "runtimeEvidence": ["packages/core/src/client.ts", "packages/server-node/src/postgres-gateway.ts"], "verificationEvidence": ["packages/core/test/lifecycle.test.ts", "packages/store-postgres/test/postgres.integration.test.ts"] },
    { "id": "foreground-stale-replacement", "title": "Foreground stale-transport replacement", "protocolStatus": "defined", "runtimeStatus": "unsupported", "roadmapStatus": "not-planned", "verifiedEnvironments": [], "protocolEvidence": ["conformance/v1/scenarios.json"], "runtimeEvidence": ["packages/core/src/client.ts"], "verificationEvidence": ["packages/core/test/lifecycle.test.ts"] },
    { "id": "standalone-memory", "title": "Standalone/in-memory server profile", "protocolStatus": "not-applicable", "runtimeStatus": "internal-fixture", "roadmapStatus": "not-planned", "verifiedEnvironments": ["repository test harness only"], "protocolEvidence": [], "runtimeEvidence": ["packages/server-node/src/server.ts"], "verificationEvidence": ["packages/server-node/test/validation.test.ts"] },
    { "id": "socket-io", "title": "Socket.IO transport adapter", "protocolStatus": "not-defined", "runtimeStatus": "not-implemented", "roadmapStatus": "committed-post-alpha", "verifiedEnvironments": [], "protocolEvidence": [], "runtimeEvidence": [], "verificationEvidence": [] },
    { "id": "telemetry-contract", "title": "Vendor-neutral telemetry contract", "protocolStatus": "not-defined", "runtimeStatus": "not-implemented", "roadmapStatus": "committed-post-alpha", "verifiedEnvironments": [], "protocolEvidence": [], "runtimeEvidence": [], "verificationEvidence": [] },
    { "id": "sentry", "title": "Sentry integration", "protocolStatus": "not-applicable", "runtimeStatus": "not-implemented", "roadmapStatus": "committed-post-alpha", "verifiedEnvironments": [], "protocolEvidence": [], "runtimeEvidence": [], "verificationEvidence": [] },
    { "id": "opentelemetry", "title": "OpenTelemetry integration", "protocolStatus": "not-applicable", "runtimeStatus": "not-implemented", "roadmapStatus": "committed-post-alpha", "verifiedEnvironments": [], "protocolEvidence": [], "runtimeEvidence": [], "verificationEvidence": [] },
    { "id": "react-native", "title": "React Native client", "protocolStatus": "not-applicable", "runtimeStatus": "not-implemented", "roadmapStatus": "committed-post-alpha", "verifiedEnvironments": [], "protocolEvidence": [], "runtimeEvidence": [], "verificationEvidence": [] },
    { "id": "go-server", "title": "Go server SDK/runtime", "protocolStatus": "not-applicable", "runtimeStatus": "not-implemented", "roadmapStatus": "committed-post-alpha", "verifiedEnvironments": [], "protocolEvidence": [], "runtimeEvidence": [], "verificationEvidence": [] },
    { "id": "durable-diagnostics", "title": "Durable diagnostics exporter/store", "protocolStatus": "not-applicable", "runtimeStatus": "not-implemented", "roadmapStatus": "committed-post-alpha", "verifiedEnvironments": [], "protocolEvidence": [], "runtimeEvidence": [], "verificationEvidence": [] },
    { "id": "production-mcp", "title": "Authenticated production MCP query service", "protocolStatus": "not-applicable", "runtimeStatus": "not-implemented", "roadmapStatus": "committed-post-alpha", "verifiedEnvironments": [], "protocolEvidence": [], "runtimeEvidence": [], "verificationEvidence": [] },
    { "id": "presence", "title": "Presence", "protocolStatus": "not-defined", "runtimeStatus": "not-implemented", "roadmapStatus": "demand-gated-candidate", "verifiedEnvironments": [], "protocolEvidence": [], "runtimeEvidence": [], "verificationEvidence": [] },
    { "id": "redis", "title": "Redis adapter", "protocolStatus": "not-defined", "runtimeStatus": "not-implemented", "roadmapStatus": "demand-gated-candidate", "verifiedEnvironments": [], "protocolEvidence": [], "runtimeEvidence": [], "verificationEvidence": [] },
    { "id": "nats", "title": "NATS adapter", "protocolStatus": "not-defined", "runtimeStatus": "not-implemented", "roadmapStatus": "demand-gated-candidate", "verifiedEnvironments": [], "protocolEvidence": [], "runtimeEvidence": [], "verificationEvidence": [] },
    { "id": "kafka", "title": "Kafka adapter", "protocolStatus": "not-defined", "runtimeStatus": "not-implemented", "roadmapStatus": "demand-gated-candidate", "verifiedEnvironments": [], "protocolEvidence": [], "runtimeEvidence": [], "verificationEvidence": [] }
  ]
}
